{
  "$schema": "https://json-schema.org/draft/2020-12/schema",
  "$id": "https://eigiib.example/schemas/eigiib-e16-a3-authority-manifest.schema.json",
  "title": "EIGIIB E16-A3 authority manifest",
  "type": "object",
  "additionalProperties": false,
  "required": [
    "standard",
    "status",
    "profile_revision",
    "source_e16_a2_commit",
    "required_authorities",
    "authorities"
  ],
  "properties": {
    "standard": {
      "const": "EIGIIB-E16-A3-AUTHORITY-MANIFEST-1.0"
    },
    "status": {
      "const": "authoritative-slice-overlay"
    },
    "profile_revision": {
      "const": "EIGIIB-E16-draft-1.0"
    },
    "source_e16_a2_commit": {
      "const": "1bd5929a5a4415df8758b220765925ac80a797bc"
    },
    "required_authorities": {
      "const": [
        "contract",
        "authority_manifest",
        "registry",
        "transition",
        "authority_freeze",
        "human_mastery",
        "manual_review",
        "registry_schema",
        "manifest_schema",
        "transition_schema",
        "freeze_schema",
        "checker",
        "historical_replay",
        "tests",
        "expected_report",
        "workflow"
      ]
    },
    "authorities": {
      "type": "object",
      "additionalProperties": false,
      "required": [
        "contract",
        "authority_manifest",
        "registry",
        "transition",
        "authority_freeze",
        "human_mastery",
        "manual_review",
        "registry_schema",
        "manifest_schema",
        "transition_schema",
        "freeze_schema",
        "checker",
        "historical_replay",
        "tests",
        "expected_report",
        "workflow"
      ],
      "properties": {
        "contract": {
          "const": "extensions/E16-A3-RETENTION-WINDOWS-BOUNDED-PRESERVATION-INDEPENDENT-READBACK-RESTORE-VERIFICATION.md"
        },
        "authority_manifest": {
          "const": "conformance/e16-a3-authority-manifest.json"
        },
        "registry": {
          "const": "conformance/retention-readback-restore.json"
        },
        "transition": {
          "const": "conformance/e16-a3-adoption-transition.json"
        },
        "authority_freeze": {
          "const": "conformance/e16-a3-authority-freeze.json"
        },
        "human_mastery": {
          "const": "docs/E16-A3-HUMAN-MASTERY-GUIDE.md"
        },
        "manual_review": {
          "const": "conformance/E16-A3-MANUAL-REVIEW.md"
        },
        "registry_schema": {
          "const": "schemas/eigiib-e16-a3-retention-readback-restore.schema.json"
        },
        "manifest_schema": {
          "const": "schemas/eigiib-e16-a3-authority-manifest.schema.json"
        },
        "transition_schema": {
          "const": "schemas/eigiib-e16-a3-adoption-transition.schema.json"
        },
        "freeze_schema": {
          "const": "schemas/eigiib-e16-a3-authority-freeze.schema.json"
        },
        "checker": {
          "const": "tools/eigiib_retention_readback_restore_check.py"
        },
        "historical_replay": {
          "const": "tools/eigiib_historical_e16_a2_replay.py"
        },
        "tests": {
          "const": "tests/test_eigiib_retention_readback_restore.py"
        },
        "expected_report": {
          "const": "tests/fixtures/e16-a3/expected-report.json"
        },
        "workflow": {
          "const": ".github/workflows/e16-a3-retention-readback-restore.yml"
        }
      }
    }
  }
}
